,index,PatientGuid,DiagnosisGuid,ICD9Code,DiagnosisDescription,StartYear_y,StopYear,Acute
0,116752,006948F2-1118-4F56-A561-6A254EE357C6,69653FA7-809F-4886-9744-2C8FD90F968C,075.,Infectious mononucleosis,2012.0,2012.0,0
0,116757,006948F2-1118-4F56-A561-6A254EE357C6,EFB101E1-E32E-436C-B0F0-2CFDE7662A3E,682.0,Cellulitis and abscess of face,2012.0,2012.0,0
0,116762,006948F2-1118-4F56-A561-6A254EE357C6,65D810CF-8BDA-4B6E-AFA6-3E3EA1007006,691.8,Other atopic dermatitis and related conditions,2012.0,2012.0,0
0,116767,006948F2-1118-4F56-A561-6A254EE357C6,81F626C3-74D0-4C68-B2B7-A53B11A623A8,785.6,Enlargement of lymph nodes,2011.0,2012.0,0
0,116772,006948F2-1118-4F56-A561-6A254EE357C6,BE595F60-76B9-41E1-9FA9-AF703EF79683,785.6,Enlargement of lymph nodes,2012.0,2012.0,0
0,116777,006948F2-1118-4F56-A561-6A254EE357C6,19303617-6E8C-4E07-BEAB-CFF036DC411B,V70.0,Routine general medical examination at a health care facility,,,0
0,116782,006948F2-1118-4F56-A561-6A254EE357C6,DCC1DFAE-9CE2-47C6-8139-60D0C33EA30B,995.3,"Allergy, unspecified, not elsewhere classified",2011.0,,0
0,116792,006948F2-1118-4F56-A561-6A254EE357C6,D213F8AE-F737-409C-BC9D-985BA91D686E,034.0,Streptococcal sore throat,2012.0,2012.0,0
