,index,PatientGuid,MedicationName_y,MedicationStrength,Schedule,PrescriptionGuid,MedicationGuid,PrescriptionYear,Quantity,NumberOfRefills,RefillAsNeeded,GenericAllowed
0,12343,22318D9E-BC67-49D7-B185-20EA608D1630,Ecotrin (aspirin) oral enteric coated tablet,325 mg,,ECAD7033-39E5-4D31-B5DA-0A7AD12B7FEB,01913BB9-843E-432E-97AE-59217A697ADC,2010.0,,,0.0,1.0
0,12352,22318D9E-BC67-49D7-B185-20EA608D1630,Plavix (clopidogrel) oral tablet,75 mg,,E10D39C5-AB6A-49C7-B733-D7C21107442F,034C17CE-864E-4F1C-848E-86D7557BF63D,2010.0,,,0.0,1.0
0,12361,22318D9E-BC67-49D7-B185-20EA608D1630,Lotrisone (betamethasone-clotrimazole topical) topical lotion,0.05%-1%,,5A7FB1FD-435A-4021-AF05-1614144EECAB,3CC18F47-28C8-4E89-8632-1F224B121DB6,2010.0,30,1,0.0,1.0
0,12370,22318D9E-BC67-49D7-B185-20EA608D1630,Desitin Rapid Relief Creamy (zinc oxide topical) topical ointment,10%,,4E78659A-CE4C-446C-8898-001891D51547,598F4437-2D50-4176-ACD1-4D6EDF80CE04,2010.0,60,1,0.0,1.0
0,12379,22318D9E-BC67-49D7-B185-20EA608D1630,Keppra (levETIRAcetam) oral tablet,250 mg,,D640D4AD-099F-4E70-99D1-EE87246A0488,D1F636F2-92DA-436E-B3A1-F46B5D524BCC,2010.0,60,,0.0,1.0
0,12388,22318D9E-BC67-49D7-B185-20EA608D1630,Prevacid (lansoprazole) oral delayed release capsule,30 mg,,92F365ED-E898-4AE0-AEA7-FC2EAE9F2655,FE5B1596-B8CD-439F-B8C0-4D2297F7E134,2010.0,,,0.0,1.0
