,index,PatientGuid,MedicationName_y,MedicationStrength,Schedule,PrescriptionGuid,MedicationGuid,PrescriptionYear,Quantity,NumberOfRefills,RefillAsNeeded,GenericAllowed
0,171067,2E8CBBD7-C967-43E3-A5A9-E6F04DE7C74C,Augmentin (amoxicillin-clavulanate) oral tablet,875 mg-125 mg,,E5F9D756-A98B-483B-980C-0601A70578EA,7A417FAE-AF79-4C92-81FF-37E179D43D46,2010.0,20,0.0,0.0,1.0
0,171075,2E8CBBD7-C967-43E3-A5A9-E6F04DE7C74C,"Mucinex D (guaiFENesin-pseudoephedrine) oral tablet, extended release",600 mg-60 mg,,4E77A1C5-1614-4767-9340-CE4EC3D9306D,6E1BFC88-A50C-4EC0-94DE-B0A29EBA7D74,2010.0,20,0.0,0.0,1.0
0,171083,2E8CBBD7-C967-43E3-A5A9-E6F04DE7C74C,Anusol-HC (hydrocortisone topical) rectal cream with applicator,2.5%,,8B869C5F-F567-4267-A2F8-1C037246A4C8,66BA201B-800B-4FE7-AB02-6045EB911448,2010.0,30,3.0,0.0,1.0
0,171099,2E8CBBD7-C967-43E3-A5A9-E6F04DE7C74C,Anusol-HC (hydrocortisone topical) rectal suppository,25 mg,,A766EE2A-3CDE-47EE-B179-9D093C1D324A,62EB7887-341B-4501-AD0B-CBA09D5A9992,2010.0,24,0.0,0.0,1.0
0,171107,2E8CBBD7-C967-43E3-A5A9-E6F04DE7C74C,Lotrisone (betamethasone-clotrimazole topical) topical cream,0.05%-1%,,25FC317C-0BDC-4D1E-87EF-4BEFFB845FC1,5CB61201-62BF-4CA1-958C-4F87588F095E,2010.0,30,1.0,0.0,1.0
0,171115,2E8CBBD7-C967-43E3-A5A9-E6F04DE7C74C,Metoprolol Tartrate (metoprolol) oral tablet,50 mg,,3BF426E2-5C00-48DF-B783-CE2EF82BAA83,E24FD01F-E596-42EC-AA31-1CF0F2F44451,2010.0,,,0.0,1.0
0,171131,2E8CBBD7-C967-43E3-A5A9-E6F04DE7C74C,Hydrochlorothiazide oral capsule,12.5 mg,,59C7DF4C-9249-491C-AA3C-03301553C38E,C8528A88-6693-48D4-BD9F-BFA01774B318,2012.0,30.0,2.0,0.0,1.0
0,171139,2E8CBBD7-C967-43E3-A5A9-E6F04DE7C74C,Hydrochlorothiazide oral capsule,12.5 mg,,87D0D49B-2D36-4555-A6EF-01C8FB4F5326,A21DB7C5-1CDB-4DA5-8330-D4115D3E9D28,2010.0,30,12.0,0.0,1.0
