,index,PatientGuid,DiagnosisGuid,ICD9Code,DiagnosisDescription,StartYear_y,StopYear,Acute
0,168046,73C66D01-0411-40BF-95CD-E173BDCD69EE,4127C271-1A93-4F7A-9FCC-55D4799501C0,706.2,Sebaceous cyst,2009.0,,0
0,168060,73C66D01-0411-40BF-95CD-E173BDCD69EE,30063C85-EFF5-4755-B0D4-74D8EC02B46B,216.3,Benign neoplasm of skin of other and unspecified parts of face,2009.0,,0
0,168074,73C66D01-0411-40BF-95CD-E173BDCD69EE,89C1FA69-06E0-472C-80F4-9F566FBBE707,V70.0,Routine general medical examination at a health care facility,2012.0,,0
0,168088,73C66D01-0411-40BF-95CD-E173BDCD69EE,B086B4D6-C87A-49E7-AD18-702C48514E50,272.4,Other and unspecified hyperlipidemia,2009.0,,0
0,168116,73C66D01-0411-40BF-95CD-E173BDCD69EE,A222FB6C-AC48-427B-BC34-E3FBDFDAFD19,696.1,Other psoriasis and similar disorders excluding psoriatic arthropathy,2012.0,,0
