,index,PatientGuid,DiagnosisGuid,ICD9Code,DiagnosisDescription,StartYear_y,StopYear,Acute
0,116802,7DFE0671-0F63-4011-BFD9-6A5D225D70EC,C6E362DE-73D3-4FE1-84AB-249B1BE1B829,717.9,Unspecified internal derangement of knee,2010.0,,0
0,116808,7DFE0671-0F63-4011-BFD9-6A5D225D70EC,8A5B06F6-587E-47BD-B54A-69AB3A45676A,562.10,Diverticulosis of colon (without mention of hemorrhage),2011.0,,0
0,116814,7DFE0671-0F63-4011-BFD9-6A5D225D70EC,6178C83C-D70E-4A10-BB2E-9CC4B06F49FE,722.93,Other and unspecified disc disorder of lumbar region,2010.0,,0
0,116820,7DFE0671-0F63-4011-BFD9-6A5D225D70EC,0908B050-9128-4ACC-87AC-EC97274FAE11,V72.84,"Preoperative examination, unspecified",2011.0,,0
0,116826,7DFE0671-0F63-4011-BFD9-6A5D225D70EC,35E3C6FC-E89B-4780-A319-F4346CC93012,726.10,"Disorders of bursae and tendons in shoulder region, unspecified",2010.0,,0
0,116832,7DFE0671-0F63-4011-BFD9-6A5D225D70EC,E9DD0B9B-F214-4E19-803E-6036F849DC56,272.4,Other and unspecified hyperlipidemia,,,0
0,116844,7DFE0671-0F63-4011-BFD9-6A5D225D70EC,09EC9F11-3787-4693-8B8F-7DD0BAE3EA81,455.6,Unspecified hemorrhoids without mention of complication,2011.0,,0
0,116862,7DFE0671-0F63-4011-BFD9-6A5D225D70EC,ABA8882D-CB86-4D78-8DEF-8C5F7E86571B,414.01,Coronary atherosclerosis of native coronary artery,,,0
0,116868,7DFE0671-0F63-4011-BFD9-6A5D225D70EC,E5D91034-BD3E-417B-9D1A-ADBEEDE9E73C,401.9,Unspecified essential hypertension,2011.0,,0
