,index,PatientGuid,DiagnosisGuid,ICD9Code,DiagnosisDescription,StartYear_y,StopYear,Acute
0,1983,B3E48483-AB7B-4446-BD08-08E280921B25,12DF56C9-C238-4BE8-8964-0C83E5848D1F,V70.0,Routine general medical examination at a health care facility,2011.0,,0
0,1986,B3E48483-AB7B-4446-BD08-08E280921B25,6BE5E3DF-B25F-4283-B768-264CCD1B301B,110.4,Dermatophytosis of foot,2009.0,,0
0,1989,B3E48483-AB7B-4446-BD08-08E280921B25,EF648572-CADC-4387-9F07-8D0B9244E765,110.1,Dermatophytosis of nail,2009.0,,0
0,1992,B3E48483-AB7B-4446-BD08-08E280921B25,E277282E-9B65-4A97-8BFB-0E272E551B76,250.03,type I diabetes mellitus [juvenile type] uncontrolled without mention of complication,2011.0,,0
0,2010,B3E48483-AB7B-4446-BD08-08E280921B25,8BE04529-9CA8-4140-8FFB-EC6F105E0DD8,272.4,Other and unspecified hyperlipidemia,2011.0,,0
