,index,PatientGuid,MedicationName_y,MedicationStrength,Schedule,PrescriptionGuid,MedicationGuid,PrescriptionYear,Quantity,NumberOfRefills,RefillAsNeeded,GenericAllowed
0,16091,C3873E35-4A18-40EA-B6FE-27F986BB6788,Desyrel (traZODone) oral tablet,50 mg,,0473FE05-E4AB-46F4-9873-5AD69E68C62D,49CB20EF-7836-4CB3-B02F-EAAEA6AE7484,2012.0,30,2,0.0,1.0
0,16151,C3873E35-4A18-40EA-B6FE-27F986BB6788,Septra DS (sulfamethoxazole-trimethoprim) oral tablet,800 mg-160 mg,,4E8F5B8A-DBBC-4D90-B62F-E577561A388A,D1A57400-D6B0-4346-B994-116B61EDBC91,2010.0,20,0,0.0,1.0
0,16157,C3873E35-4A18-40EA-B6FE-27F986BB6788,TraMADol Hydrochloride (traMADol) oral tablet,50 mg,,84038554-C12B-4BF7-958F-7A90694D2996,2D5A18C7-0358-4DCA-89D0-0D157DDC271E,2010.0,60,0,0.0,1.0
0,16169,C3873E35-4A18-40EA-B6FE-27F986BB6788,Robaxin-750 (methocarbamol) oral tablet,750 mg,,221D521E-7F84-4B52-A5BA-B6D0981F913D,A5058DF2-838C-46BD-869E-683845E273A2,2012.0,60,3,0.0,1.0
0,16175,C3873E35-4A18-40EA-B6FE-27F986BB6788,Vicodin (acetaminophen-HYDROcodone) oral tablet,500 mg-5 mg,3.0,35AD712F-4F70-4365-89D0-E06C93DCEFDF,941047B2-1B78-453C-9708-DC139A2F944D,2010.0,30,2,0.0,1.0
