,index,PatientGuid,MedicationName_y,MedicationStrength,Schedule,PrescriptionGuid,MedicationGuid,PrescriptionYear,Quantity,NumberOfRefills,RefillAsNeeded,GenericAllowed
0,154230,CBB3B7ED-BF15-4169-827A-C28BEDDD6773,Lodine (etodolac) oral tablet,500 mg,,A35A1575-4A26-4835-8447-420E595F2824,069B7A01-D6BE-4CA9-B54E-05ED0CE80E3F,2011.0,60,0.0,0.0,1.0
0,154234,CBB3B7ED-BF15-4169-827A-C28BEDDD6773,Robaxin-750 (methocarbamol) oral tablet,750 mg,,5A6E26D3-5667-4CED-82AF-96D084FE313C,01E866BA-1AF9-4502-B293-1B7E49143DAB,2011.0,60,0.0,0.0,1.0
0,154238,CBB3B7ED-BF15-4169-827A-C28BEDDD6773,Ativan (LORazepam) oral tablet,1 mg,4.0,90966A66-8EC3-490E-A25A-7C3CDD6DBCDC,90F1FF83-6F51-45D5-A7C4-F05442D9D402,2009.0,20,,0.0,1.0
0,154246,CBB3B7ED-BF15-4169-827A-C28BEDDD6773,Hyzaar (hydrochlorothiazide-losartan) oral tablet,25 mg-100 mg,,916F364D-A75D-42F2-9C6F-283D43E1AB41,3836F4A0-B18C-44E5-A860-3BEFC8FE4224,2009.0,90,3.0,0.0,1.0
0,154250,CBB3B7ED-BF15-4169-827A-C28BEDDD6773,"Propranolol Hydrochloride LA (propranolol) oral capsule, extended release",60 mg,,D5B2D2AE-87F2-459E-90FF-5FFF06957698,24767432-252A-4835-867A-92F095AF3196,2012.0,60,5.0,0.0,1.0
0,154258,CBB3B7ED-BF15-4169-827A-C28BEDDD6773,"Mucinex D (guaiFENesin-pseudoephedrine) oral tablet, extended release",600 mg-60 mg,,1FD15589-0839-431E-91D6-41D95991680B,C2A2B4FE-DFAB-4F8B-99E4-C5C55A4C6EA6,2011.0,30,0.0,0.0,1.0
