,index,PatientGuid,MedicationName_y,MedicationStrength,Schedule,PrescriptionGuid,MedicationGuid,PrescriptionYear,Quantity,NumberOfRefills,RefillAsNeeded,GenericAllowed
0,260761,DF251E86-1947-4DAC-826E-304A50D28DCD,"Actoplus Met XR (metFORMIN-pioglitazone) oral tablet, extended release",1000 mg-15 mg,,F24BA045-053B-4421-B976-09DD6418B971,BA64D545-0D7E-4864-9FEF-F30A59454257,2011.0,180.0,3.0,0.0,1.0
0,260881,DF251E86-1947-4DAC-826E-304A50D28DCD,Actoplus Met (metFORMIN-pioglitazone) oral tablet,500 mg-15 mg,,840D6D25-ED97-4ED7-BEA3-914F3F5503E3,02BB57D1-7DA0-4F46-88BE-D01DABAFDAD8,2010.0,60.0,3.0,0.0,1.0
0,260921,DF251E86-1947-4DAC-826E-304A50D28DCD,Reglan (metoclopramide) oral tablet,5 mg,,AB906914-0B2B-4A0D-AEE4-E852F20A83C3,841F0EA3-AD07-46F7-8A21-4EDD306B564D,2010.0,30.0,0.0,0.0,1.0
0,260961,DF251E86-1947-4DAC-826E-304A50D28DCD,Benicar HCT (hydrochlorothiazide-olmesartan) oral tablet,12.5 mg-40 mg,,E0C2C9F7-4088-4897-873D-8F72DB5ED3D9,3BAB8038-7318-47EA-9D87-A1A51932D876,2011.0,28.0,,0.0,1.0
0,261001,DF251E86-1947-4DAC-826E-304A50D28DCD,Benicar HCT (hydrochlorothiazide-olmesartan) oral tablet,25 mg-40 mg,,F66AE475-CA96-4C72-B1C5-1A96704F8CD1,B2DE8846-DEA4-4E26-90C0-BDE0C932FC0D,2011.0,90.0,3.0,0.0,1.0
