,index,PatientGuid,MedicationName_y,MedicationStrength,Schedule,PrescriptionGuid,MedicationGuid,PrescriptionYear,Quantity,NumberOfRefills,RefillAsNeeded,GenericAllowed
0,20812,EDA6A542-28AA-4E7E-9676-31F5D4CA66E7,Septra DS (sulfamethoxazole-trimethoprim) oral tablet,800 mg-160 mg,,5093D73F-342B-4056-AD16-D9BAE01B2A75,86326013-DD8B-4D4C-A1DA-A7A06066D704,2011.0,20,0.0,0.0,1.0
0,20820,EDA6A542-28AA-4E7E-9676-31F5D4CA66E7,Augmentin (amoxicillin-clavulanate) oral tablet,875 mg-125 mg,,43C630AB-6E2B-42C0-ACB3-6694BC852094,7BECF8B9-B619-4425-A228-F072439C178A,2011.0,20,0.0,0.0,1.0
0,20836,EDA6A542-28AA-4E7E-9676-31F5D4CA66E7,Coumadin (warfarin) oral tablet,5 mg,,805A0A6C-7292-4375-A855-B49CFAFB035D,CC226A36-C8CA-46DA-A361-5E6D40A601C7,2012.0,30,1.0,0.0,1.0
0,20844,EDA6A542-28AA-4E7E-9676-31F5D4CA66E7,Coumadin (warfarin) oral tablet,3 mg,,574B6B99-4CE4-4E33-94BA-4ADFBA99541E,9C3410B0-6C4C-47AB-8DCD-7B4F15D63FA5,2012.0,30,1.0,0.0,1.0
0,20852,EDA6A542-28AA-4E7E-9676-31F5D4CA66E7,"Phenytek (phenytoin) oral capsule, extended release",300 mg,,F6601098-4CB4-4678-8718-DE2A9F9D65CD,C8424EE8-D067-4C77-A531-592D4E95F739,2010.0,90,3.0,0.0,1.0
0,20860,EDA6A542-28AA-4E7E-9676-31F5D4CA66E7,"Phenytek (phenytoin) oral capsule, extended release",300 mg,,ABF3B283-56DB-4188-8BF5-DC92B6750FAB,30738493-4898-491A-A4B7-9737B5B32B7F,2010.0,30,11.0,0.0,1.0
0,20876,EDA6A542-28AA-4E7E-9676-31F5D4CA66E7,Cortisporin Otic (hydrocortisone/neomycin/polymyxin B otic) otic suspension,1%-0.35%-10000 units/mL,,B338D42B-3FF5-4ADD-A095-7DCE87455776,AC17A87B-AF2A-4A7D-999E-257BD7806900,2011.0,10,0.0,0.0,1.0
