,index,PatientGuid,DiagnosisGuid,ICD9Code,DiagnosisDescription,StartYear_y,StopYear,Acute
0,175771,F299BC45-2D88-4FBE-92E2-F1AEF5199C7A,F47EA531-D157-49A7-BFAD-28FA49F587DC,V70.0,Routine general medical examination at a health care facility,2012.0,,0
0,175777,F299BC45-2D88-4FBE-92E2-F1AEF5199C7A,0FE5C7ED-5039-40C6-8E2A-7FA01F0561C3,794.31,Nonspecific abnormal electrocardiogram [ECG] [EKG],2012.0,,0
0,175783,F299BC45-2D88-4FBE-92E2-F1AEF5199C7A,4FB936AF-32AB-48B5-9804-82A45A59723C,995.2,Unspec adverse effect of drug due to proper administration,2012.0,,0
0,175789,F299BC45-2D88-4FBE-92E2-F1AEF5199C7A,16FE8200-E798-4A72-9DDD-C3CEE2412051,272.4,Other and unspecified hyperlipidemia,2012.0,,0
0,175795,F299BC45-2D88-4FBE-92E2-F1AEF5199C7A,8E1108F2-1328-4FD7-B48E-C4343B96E332,185.,Malignant neoplasm of prostate,2006.0,,0
0,175801,F299BC45-2D88-4FBE-92E2-F1AEF5199C7A,B5A2067C-89CD-4ABE-9775-70C5DDFF49FA,692.9,"Contact dermatitis and other eczema, unspecified cause",2010.0,,0
0,175807,F299BC45-2D88-4FBE-92E2-F1AEF5199C7A,9ED75508-EE35-4B85-BCA9-8004C09103B4,272.1,Pure hyperglyceridemia,2010.0,,0
0,175819,F299BC45-2D88-4FBE-92E2-F1AEF5199C7A,009CCC06-D879-4698-8D00-ADE53E1C0B4B,401.9,Unspecified essential hypertension,2010.0,,0
0,175831,F299BC45-2D88-4FBE-92E2-F1AEF5199C7A,B6E78A14-2FD1-4887-9C36-BB727561D3EB,268.9,Unspecified vitamin D deficiency,2010.0,,0
