,index2,GenericAllowed,MedicationGuid,MedicationName_y,MedicationStrength,NumberOfRefills,PatientGuid,PrescriptionGuid,PrescriptionYear,Quantity,RefillAsNeeded,Schedule,index
0,6.0,1.0,DCA7B97E-3631-4DAC-8CD3-5F4DD09A03B2,Estratest H.S. (esterified estrogens-methylTESTOSTERone) oral tablet,0.625 mg-1.25 mg,2.0,F77CE7CC-7448-4F82-A1D5-51D2921B89A1,6B1ECF4A-F154-4CC4-BFA9-B06D838DDB09,2011.0,30,0.0,,59546
0,6.0,1.0,8E48EF04-4B10-4065-8F05-3BB8A0616DC5,Augmentin (amoxicillin-clavulanate) oral tablet,875 mg-125 mg,0.0,F77CE7CC-7448-4F82-A1D5-51D2921B89A1,3F64E61E-35C2-40E8-AAB9-DE9360020D46,2011.0,20,0.0,,59702
0,6.0,1.0,7F21F968-0621-41A4-B54F-5DD183BA0353,Augmentin (amoxicillin-clavulanate) oral tablet,875 mg-125 mg,0.0,F77CE7CC-7448-4F82-A1D5-51D2921B89A1,B942FC5D-E624-4805-8687-0A44B5D29179,2010.0,20,0.0,,59468
0,6.0,1.0,CE71BDE2-6D74-45F9-9382-9FBDE2FA02AC,Pyridium (phenazopyridine) oral tablet,200 mg,0.0,F77CE7CC-7448-4F82-A1D5-51D2921B89A1,14A55524-E147-4EA9-AD67-F9CDBECD305A,2012.0,15,0.0,,59663
0,6.0,1.0,76138C99-58D1-4B1B-B5B6-5E9078FA33C5,Macrodantin (nitrofurantoin) oral capsule,macrocrystals 100 mg,0.0,F77CE7CC-7448-4F82-A1D5-51D2921B89A1,3E57E9D7-3CDE-4CE5-B222-ECD6F04CAE43,2012.0,14,0.0,,59585
0,6.0,1.0,B0A56451-B0A8-4A0F-BF64-933E2D8A695D,Macrobid (nitrofurantoin) oral capsule,macrocrystals-monohydrate 100 mg,0.0,F77CE7CC-7448-4F82-A1D5-51D2921B89A1,036A5BFE-7F56-4B96-BC41-1C2EF5B57AE6,2011.0,10,0.0,,59624
0,6.0,1.0,09D7AE76-6001-45A9-A6BB-7CF92538444A,Tobrex (tobramycin ophthalmic) ophthalmic solution,0.3%,1.0,F77CE7CC-7448-4F82-A1D5-51D2921B89A1,C28E050F-F2FE-4B7A-A531-17FE15F26228,2010.0,5,0.0,,59429
