,index,PatientGuid,AllergyGuid,StartYear_x,ReactionName,SeverityName,AllergyName
0,73684,F86D1ED0-AE76-4486-BDF4-6A0A0E15A87D,5D8AD130-AB89-4EB5-ADDA-1C034AB9B3CD,2011.0,Rash - generalized,Mild,Cipro (ciprofloxacin) oral tablet
0,73721,F86D1ED0-AE76-4486-BDF4-6A0A0E15A87D,827A846E-0BB1-4583-8494-20C1CA8E0604,2011.0,Rash - generalized,Mild,Macrobid (nitrofurantoin) oral capsule
0,73758,F86D1ED0-AE76-4486-BDF4-6A0A0E15A87D,4C837902-5BD8-400A-9055-53F9C6D858D4,2011.0,Rash - generalized,Mild,Septra DS (sulfamethoxazole-trimethoprim) oral tablet
0,73795,F86D1ED0-AE76-4486-BDF4-6A0A0E15A87D,193B6177-7A9F-4EFB-B7C9-955C69B89D43,2011.0,Rash - generalized,Mild,Zithromax (azithromycin) oral tablet
0,73832,F86D1ED0-AE76-4486-BDF4-6A0A0E15A87D,156A7A4B-99FF-444A-B9FF-D9CCEA965996,2011.0,Rash - localized,Mild,Iodine USP (iodine topical) topical tincture
0,73869,F86D1ED0-AE76-4486-BDF4-6A0A0E15A87D,366D4AB5-A886-4F85-A042-F5F1E3861B56,2011.0,Itchiness,Modest,Morphine Sulfate (morphine) intravenous solution
